{
  "name": "fintech-gradient",
  "label": "Fintech Gradient",
  "description": "Fintex: toʻq indigo, binafsha-yalpiz mesh, Montserrat, 3D soʻzlar, raqam sanash, clock-wipe.",
  "tone": "dark",
  "fonts": {
    "display": {
      "family": "Montserrat",
      "weight": 700,
      "lightWeight": 300,
      "uppercase": false,
      "letterSpacing": -0.03,
      "charEm": 0.66
    },
    "body": {
      "family": "Inter",
      "weight": 500,
      "uppercase": false,
      "letterSpacing": -0.01,
      "charEm": 0.58
    }
  },
  "colors": {
    "bg": "#070B1E",
    "surface": "#111735",
    "text": "#F2F5FF",
    "muted": "#9AA3C7",
    "primary": "#7C3AED",
    "accent": "#34D399",
    "highlight": "#7C3AED",
    "onHighlight": "#FFFFFF"
  },
  "captionPreset": "pillGlass",
  "captionStyle": {
    "font": "display",
    "uppercase": false,
    "stroke": 0,
    "scale": 1
  },
  "defaultTextAnim": "Split3D",
  "secondaryTextAnim": "Counter",
  "ctaTextAnim": "MaskWipe",
  "defaultTransition": "clockWipe",
  "transitionFrames": 14,
  "fx": [
    "progressBar",
    "particles"
  ],
  "fxIntensity": {},
  "background": {
    "kind": "mesh",
    "colors": [
      "#7C3AED66",
      "#34D39944",
      "#2563EB55"
    ],
    "patternOpacity": 0.16,
    "angle": 160
  },
  "headline": {
    "size": 100,
    "hookSize": 116,
    "align": "center",
    "maxLines": 4,
    "stroke": 0,
    "shadow": "0 8px 30px rgba(0,0,0,0.55)",
    "scrim": 0.45
  },
  "card": {
    "glass": true,
    "radius": 28
  },
  "kenBurns": "in",
  "tempo": 1,
  "particlesColor": "#34D399",
  "meta": {
    "family": "finance",
    "mood": [
      "innovative",
      "secure",
      "smart"
    ],
    "niches": [
      "bank",
      "fintech",
      "insurance",
      "investing"
    ],
    "aida": [
      "interest",
      "desire"
    ],
    "description_uz": "Fintex: toʻq indigo fon, binafsha-yalpiz gradient, raqamlar sanaladi, shisha kartalar. Bank, toʻlov ilovalari, sugʻurta va investitsiya uchun.",
    "since": "2026-09"
  }
}
