{
  "name": "bold",
  "label": "Bold",
  "description": "Standart. Qalin Plus Jakarta 800, sariq highlight, zoom-punch kesimlar, plyonka donasi.",
  "tone": "dark",
  "fonts": {
    "display": {
      "family": "Plus Jakarta Sans",
      "weight": 800,
      "lightWeight": 400,
      "uppercase": false,
      "letterSpacing": -0.02,
      "charEm": 0.64
    },
    "body": {
      "family": "Manrope",
      "weight": 600,
      "uppercase": false,
      "letterSpacing": -0.01,
      "charEm": 0.56
    }
  },
  "colors": {
    "bg": "#0B0F19",
    "surface": "#131A2A",
    "text": "#E6EAF2",
    "muted": "#8B95AD",
    "primary": "#6366F1",
    "accent": "#FACC15",
    "highlight": "#FACC15",
    "onHighlight": "#0B0F19"
  },
  "captionPreset": "karaoke",
  "captionStyle": {
    "font": "display",
    "uppercase": false,
    "stroke": 6,
    "scale": 1
  },
  "defaultTextAnim": "WordPop",
  "secondaryTextAnim": "Highlighter",
  "ctaTextAnim": "BounceIn",
  "defaultTransition": "zoomPunch",
  "transitionFrames": 10,
  "fx": [
    "grain",
    "vignette"
  ],
  "fxIntensity": {
    "grain": 0.07,
    "vignette": 0.45
  },
  "background": {
    "kind": "brand",
    "colors": [
      "#6366F1",
      "#22D3EE"
    ],
    "patternOpacity": 0.16,
    "angle": 160
  },
  "headline": {
    "size": 104,
    "hookSize": 124,
    "align": "center",
    "maxLines": 4,
    "stroke": 0,
    "shadow": "0 8px 30px rgba(0,0,0,0.55)",
    "scrim": 0.45
  },
  "card": {
    "glass": true,
    "radius": 36
  },
  "kenBurns": "in",
  "tempo": 1,
  "meta": {
    "family": "bold",
    "mood": [
      "energetic",
      "confident"
    ],
    "niches": [
      "retail",
      "services",
      "promo",
      "universal"
    ],
    "aida": [
      "attention",
      "action"
    ],
    "description_uz": "Universal standart: qalin sarlavha, sariq karaoke subtitr. Mahsulot, xizmat va aksiya videolari uchun xavfsiz tanlov.",
    "since": "2026-08"
  }
}
