{
  "name": "jewel",
  "label": "Jewel",
  "description": "Qimmatbaho tosh: zumrad fon, Yeseva One, oltin marker, sekin fokus, zarrachalar.",
  "tone": "dark",
  "fonts": {
    "display": {
      "family": "Yeseva One",
      "weight": 400,
      "uppercase": false,
      "letterSpacing": 0,
      "charEm": 0.64
    },
    "body": {
      "family": "Tenor Sans",
      "weight": 400,
      "uppercase": false,
      "letterSpacing": 0.02,
      "charEm": 0.62
    }
  },
  "colors": {
    "bg": "#03140F",
    "surface": "#0A2A20",
    "text": "#F0FFF8",
    "muted": "#8FBFAE",
    "primary": "#10B981",
    "accent": "#6EE7B7",
    "highlight": "#E7C873",
    "onHighlight": "#03140F"
  },
  "captionPreset": "pillGlass",
  "captionStyle": {
    "font": "body",
    "uppercase": false,
    "stroke": 0,
    "scale": 1
  },
  "defaultTextAnim": "BlurFocus",
  "secondaryTextAnim": "Highlighter",
  "ctaTextAnim": "CharCascade",
  "defaultTransition": "fade",
  "transitionFrames": 16,
  "fx": [
    "particles",
    "lensFlare",
    "vignette"
  ],
  "fxIntensity": {
    "vignette": 0.5
  },
  "background": {
    "kind": "mesh",
    "colors": [
      "#10B98155",
      "#E7C87322",
      "#0A2A2088"
    ],
    "patternOpacity": 0.16,
    "angle": 160
  },
  "headline": {
    "size": 100,
    "hookSize": 116,
    "align": "center",
    "maxLines": 4,
    "stroke": 0,
    "shadow": "0 8px 30px rgba(0,0,0,0.55)",
    "scrim": 0.45
  },
  "card": {
    "glass": true,
    "radius": 20
  },
  "kenBurns": "out",
  "tempo": 1.3,
  "particlesColor": "#E7C873",
  "meta": {
    "family": "luxury",
    "mood": [
      "precious",
      "elegant",
      "rich"
    ],
    "niches": [
      "jewelry",
      "cosmetics",
      "premium-gifts",
      "wedding"
    ],
    "aida": [
      "desire",
      "action"
    ],
    "description_uz": "Qimmatbaho tosh: zumrad-yashil chuqur fon, nafis serif, oltin marker va uchqunlar. Zargarlik, sovgʻalar, toʻy xizmatlari va premium kosmetika uchun.",
    "since": "2026-09"
  }
}
