{
  "name": "minimal",
  "label": "Minimal",
  "description": "Manrope, koʻp boʻsh joy, chapga tekislangan, MaskWipe + fade. Tinch, zamonaviy.",
  "tone": "dark",
  "fonts": {
    "display": {
      "family": "Manrope",
      "weight": 700,
      "lightWeight": 300,
      "uppercase": false,
      "letterSpacing": -0.03,
      "charEm": 0.58
    },
    "body": {
      "family": "Manrope",
      "weight": 500,
      "uppercase": false,
      "letterSpacing": -0.01,
      "charEm": 0.56
    }
  },
  "colors": {
    "bg": "#0E1116",
    "surface": "#161B22",
    "text": "#F2F4F8",
    "muted": "#8B95AD",
    "primary": "#6366F1",
    "accent": "#22D3EE",
    "highlight": "#22D3EE",
    "onHighlight": "#0E1116"
  },
  "captionPreset": "lineByLine",
  "captionStyle": {
    "font": "body",
    "uppercase": false,
    "stroke": 0,
    "scale": 0.95
  },
  "defaultTextAnim": "MaskWipe",
  "secondaryTextAnim": "TypeWriter",
  "ctaTextAnim": "MaskWipe",
  "defaultTransition": "fade",
  "transitionFrames": 14,
  "fx": [],
  "fxIntensity": {},
  "background": {
    "kind": "solid",
    "colors": [
      "#0E1116"
    ],
    "patternOpacity": 0.16,
    "angle": 160
  },
  "headline": {
    "size": 84,
    "hookSize": 96,
    "align": "left",
    "maxLines": 4,
    "stroke": 0,
    "shadow": "0 8px 30px rgba(0,0,0,0.55)",
    "scrim": 0.35
  },
  "card": {
    "glass": false,
    "radius": 20
  },
  "kenBurns": "in",
  "tempo": 1.1,
  "meta": {
    "family": "minimal",
    "mood": [
      "calm",
      "modern"
    ],
    "niches": [
      "design",
      "it",
      "architecture",
      "consulting"
    ],
    "aida": [
      "interest",
      "desire"
    ],
    "description_uz": "Tinch va zamonaviy: koʻp boʻsh joy, chapga tekis matn, sokin fade. Dizayn, IT va “ortiqcha shovqinsiz” brendlar uchun.",
    "since": "2026-08"
  }
}
