{
  "name": "earth",
  "label": "Earth",
  "description": "Tuproq ranglari: terrakota, Oswald, 3D soʻzlar, slide, plyonka donasi.",
  "tone": "dark",
  "fonts": {
    "display": {
      "family": "Oswald",
      "weight": 600,
      "lightWeight": 300,
      "uppercase": false,
      "letterSpacing": 0,
      "charEm": 0.52
    },
    "body": {
      "family": "Inter",
      "weight": 500,
      "uppercase": false,
      "letterSpacing": -0.01,
      "charEm": 0.58
    }
  },
  "colors": {
    "bg": "#1C130E",
    "surface": "#2B1D15",
    "text": "#F5EBDD",
    "muted": "#B39C86",
    "primary": "#C2410C",
    "accent": "#F59E6B",
    "highlight": "#D97745",
    "onHighlight": "#1C130E"
  },
  "captionPreset": "karaoke",
  "captionStyle": {
    "font": "display",
    "uppercase": false,
    "stroke": 5,
    "strokeColor": "#1C130E",
    "scale": 1
  },
  "defaultTextAnim": "Split3D",
  "secondaryTextAnim": "Counter",
  "ctaTextAnim": "MaskWipe",
  "defaultTransition": "slide",
  "transitionFrames": 14,
  "fx": [
    "grain",
    "vignette"
  ],
  "fxIntensity": {
    "grain": 0.1,
    "vignette": 0.45
  },
  "background": {
    "kind": "gradient",
    "colors": [
      "#1C130E",
      "#3A2518"
    ],
    "patternOpacity": 0.16,
    "angle": 170
  },
  "headline": {
    "size": 128,
    "hookSize": 148,
    "align": "center",
    "maxLines": 4,
    "stroke": 0,
    "shadow": "0 8px 30px rgba(0,0,0,0.55)",
    "scrim": 0.45
  },
  "card": {
    "glass": false,
    "radius": 10
  },
  "kenBurns": "left",
  "tempo": 1,
  "meta": {
    "family": "warm",
    "mood": [
      "grounded",
      "honest",
      "warm"
    ],
    "niches": [
      "construction",
      "furniture",
      "ceramics",
      "tourism"
    ],
    "aida": [
      "interest",
      "desire"
    ],
    "description_uz": "Tuproq va terrakota: iliq jigarrang palitra, tor baland sarlavha, 3D soʻzlar. Qurilish, mebel, kulolchilik va turizm uchun.",
    "since": "2026-09"
  }
}
